pubDate,title,url
"Tue, 11 Jul 2017 07:46:00 GMT","BDO, Landbank among banks with 'Gold Hall of Fame' awards",http://business.inquirer.net/232911/bdo-landbank-among-banks-gold-hall-fame-awards
"Thu, 13 Jul 2017 21:28:00 GMT",Tagud camp airs side on 2GO accounting fiasco,http://business.inquirer.net/233113/tagud-camp-airs-side-2go-accounting-fiasco
"Tue, 11 Jul 2017 21:30:11 GMT",Clearer picture of 2GO accounting issue emerges,http://business.inquirer.net/232954/clearer-picture-2go-accounting-issue-emerges
"Tue, 11 Jul 2017 00:27:50 GMT",PHL credit information system on track to go live by January,http://www.bworldonline.com/content.php?section=Finance&title=phl-credit-information-system-on-track-to-go-live-by-january&id=148019
"Fri, 14 Jul 2017 12:52:43 GMT",Southeast Asian banks must embrace digital tech: execs,http://asia.nikkei.com/Features/Asia300-Global-Business-Forum-20172/Southeast-Asian-banks-must-embrace-digital-tech-execs
"Wed, 5 Jul 2017 18:58:41 GMT",What's Next for BDO UNIBANK (OTCMKTS:BDOUY) After Having More Shares Shorted?,http://weeklyregister.com/whats-next-for-bdo-unibank-otcmktsbdouy-after-having-more-shares-shorted/
"Thu, 13 Jul 2017 21:18:00 GMT",Biz Buzz: 'Lucrative transparency',http://business.inquirer.net/233102/biz-buzz-lucrative-transparency
"Sun, 9 Jul 2017 16:15:34 GMT","N. Korea, Central Bank Fears Put Pressure on Asia Investors",https://www.bloomberg.com/news/articles/2017-07-09/north-korea-central-bank-worries-put-pressure-on-asia-investors
"Wed, 12 Jul 2017 18:01:54 GMT",PSEi surges 1.02% on optimism about Marawi,http://www.manilatimes.net/psei-surges-1-02-optimism-marawi/338105/
"Tue, 11 Jul 2017 11:34:19 GMT",Philippines: AboitizPower buying out SunEdison interest in two JVs,https://www.dealstreetasia.com/stories/philippines-aboitizpower-buying-out-sunedison-units-77434/
"Tue, 11 Jul 2017 08:46:56 GMT",PSBank to deactivate non-chip ATM cards on Sept. 1,http://news.abs-cbn.com/business/07/11/17/psbank-to-deactivate-non-chip-atm-cards-on-sept-1
"Wed, 12 Jul 2017 06:58:21 GMT",Aboitiz to buy SunEdison out of Philippine solar JV,https://renewablesnow.com/news/aboitiz-to-buy-sunedison-out-of-philippine-solar-jv-575613/
"Mon, 3 Jul 2017 12:12:00 GMT",BSP to develop framework vs. cybersecurity threats to banks,http://www.gmanetwork.com/news/money/content/616733/bsp-to-develop-framework-vs-cybersecurity-threats-to-banks/story/
"Sun, 9 Jul 2017 14:52:56 GMT","Stars align for Davao businessman, ready for more acquisitions",http://www.bworldonline.com/content.php?section=TopStory&title=stars-align-for-davao-businessman-ready-for-more-acquisitions&id=147953
"Mon, 3 Jul 2017 12:03:03 GMT",Legislators ask BSP to abbreviate EMV tech compliance,http://www.businessmirror.com.ph/legislators-ask-bsp-to-abbreviate-emv-tech-compliance/
"Wed, 5 Jul 2017 06:12:55 GMT",PSBank to deactivate non-EMV cards on Sept. 1 as it shifts to chip-enabled ones,http://www.gmanetwork.com/news/money/companies/616948/psbank-to-deactivate-non-emv-cards-on-sept-1-as-it-shifts-to-chip-enabled-ones/story/
"Tue, 11 Jul 2017 10:43:58 GMT",Allocations emerge for MTF's $200m facility,http://www.globalcapital.com/article/b13tdk9zjz949h/allocations-emerge-for-mtf39s-200m-facility
"Thu, 6 Jul 2017 21:22:46 GMT","Biz Buzz: Bank treasurers, traders win at last",http://business.inquirer.net/232659/biz-buzz-bank-treasurers-traders-win-last
"Sun, 2 Jul 2017 19:10:38 GMT",Main stock index seen staying below 8000,http://business.inquirer.net/232407/main-stock-index-seen-staying-8000
"Sun, 2 Jul 2017 16:13:36 GMT",Peso seen sideways on mixed signals from US,http://www.bworldonline.com/content.php?section=Finance&title=peso-seen-sideways-on-mixed-signals-from-us&id=147584
